{
  "protocolVersion": "0.1",
  "commandId": "0a9a196b-42d3-46d1-a552-dac43d1e42ad",
  "command": "authoring.create_gameobject",
  "issuedAtUtc": "2026-06-14T12:00:00Z",
  "preconditions": {
    "sessionId": "example-session",
    "editorMode": "edit",
    "activeScenePath": "Assets/Scenes/Main.unity",
    "contextVersion": 1
  },
  "arguments": {
    "scenePath": "Assets/Scenes/Main.unity",
    "name": "CreatedByUnityIA",
    "position": {
      "x": 1,
      "y": 2,
      "z": 3
    }
  },
  "options": {
    "dryRun": false
  }
}
